,id,name,screen_name,location,description,followers_count,friends_count,listed_count,created_time,favorites_count,timezone,statuses_count,language,topic,text,stance,count,Unnamed: 0,tweet_id,user_id,time,publishing_time,publishing_days,membership_age,membership_years,WC,Analytic,Clout,Authentic,Tone,WPS,Sixltr,Dic,function,pronoun,ppron,i,you,shehe,they,ipron,article,prep,auxverb,adverb,conj,negate,verb,adj,compare,interrog,number,quant,affect,posemo,negemo,anger,social,male,cogproc,insight,cause,discrep,tentat,certain,differ,percept,see,bio,drives,affiliation,achieve,power,reward,focuspast,focuspresent,focusfuture,relativ,motion,space,time.1,work,informal,AllPunc,Period,Comma,QMark,Exclam,Apostro,OtherP
202,3280762722.0,Jean Zei rhymes w/ cry 📚‼️🍿🍿🍿,stripnotary,"Las Vegas, NV",What is Q? I listen online in #2xspeed #amway ❤️ #maga #libra #patriot 🇺🇸#SUPERelite #legalizeit,421.0,930.0,4.0,7/15/2015 0:16,6186.0,,6351.0,en,colton,He should have gone and asked âwhy would you like me to read scripted question instead of my questions?â Live right there from stage,Strong Agreement,4.0,53.0,9.67e+17,3280762722.0,2/22/2018 0:06,7 days 09:36:27.000000000,7.0,1212 days 22:06:30.034922000,3.0,7,28.22,92.33,1.0,1.0,3.5,14.29,85.71,28.57,14.29,0.0,0.0,0.0,0.0,0.0,14.29,0.0,0.0,0.0,14.29,0.0,0.0,14.29,28.57,0.0,0.0,0.0,0.0,28.57,0.0,28.57,0.0,14.29,0.0,14.29,0.0,14.29,0.0,0.0,0.0,0.0,0.0,0.0,0.0,14.29,0.0,0.0,14.29,0.0,0.0,0.0,0.0,0.0,0.0,0.0,0.0,0.0,0.0,42.86,28.57,0.0,0.0,0.0,0.0,14.29
203,8.39e+17,Sasmenot,sasmenot2022,,"Forever 45, Country girl, loves horses, family, God & Country. I do not apologize for my beliefs I am and always will be #MAGA #KAG #PATRIOT #CONSERVAT #Q",6640.0,7049.0,8.0,3/8/2017 0:15,27301.0,,31219.0,en,colton,"Finally a student with a brain, and one that was actually at the school and one of the  real hero's, not a mouth piece for CNN profiteering of the victims.",Strong Agreement,4.0,54.0,9.68e+17,8.39e+17,2/25/2018 0:12,10 days 09:42:27.000000000,10.0,610 days 22:08:05.034922000,1.0,26,23.17,77.92,17.46,89.84,26.0,19.23,84.62,53.85,15.38,15.38,7.69,3.85,3.85,0.0,0.0,0.0,11.54,11.54,11.54,3.85,0.0,30.77,0.0,0.0,3.85,0.0,0.0,3.85,3.85,0.0,0.0,15.38,3.85,23.08,7.69,3.85,7.69,7.69,0.0,3.85,0.0,0.0,3.85,0.0,0.0,0.0,0.0,0.0,7.69,7.69,0.0,7.69,3.85,3.85,0.0,3.85,0.0,3.85,0.0,0.0,3.85,0.0,0.0,0.0
204,9.23e+17,Steve Tatum,SteveTatum85,"Missouri, USA","US Veteran. Conservative. Pro-Constitution #Trump2020 #MAGA
 
(I STAND AGAINST Jihadists,Liberals,Socialists,SJWs,RINOs,Establishment Swamp,MSM & Common Idiots)",1260.0,1727.0,6.0,10/25/2017 0:15,7781.0,,13159.0,en,colton,"Reminds me of the time CNN scripted, coached, and directed a fake rally in London just like a Hollywood film crew. Also, their fake satellite remote where two correspondents pretended to speak to each other long distance via satellite but were in the same Phoenix parking lot.",Strong Agreement,5.0,56.0,9.67e+17,9.23e+17,2/23/2018 0:01,8 days 09:31:52.000000000,8.0,379 days 22:07:41.034922000,1.0,30,99.0,15.86,10.08,84.54,30.0,16.67,93.33,60.0,3.33,0.0,0.0,0.0,0.0,0.0,3.33,20.0,16.67,3.33,6.67,6.67,3.33,3.33,0.0,0.0,0.0,6.67,3.33,10.0,6.67,3.33,0.0,0.0,0.0,6.67,0.0,0.0,0.0,0.0,0.0,6.67,0.0,0.0,6.67,10.0,0.0,0.0,6.67,3.33,3.33,0.0,0.0,6.67,0.0,3.33,3.33,10.0,0.0,13.33,3.33,6.67,0.0,0.0,3.33,0.0
205,58459364.0,Julian,madaboutfm,,,390.0,634.0,7.0,7/20/2009 0:12,7650.0,,7027.0,en,colton,#cnn is a propaganda machine. Not a news organization!,Strong Agreement,3.0,58.0,9.67e+17,58459364.0,2/22/2018 0:18,7 days 09:48:06.000000000,7.0,3398 days 22:11:03.034922000,9.0,47,94.68,50.0,77.49,1.0,23.5,25.53,74.47,42.55,6.38,4.26,2.13,0.0,0.0,2.13,2.13,8.51,14.89,2.13,6.38,6.38,0.0,4.26,6.38,4.26,2.13,2.13,4.26,4.26,0.0,4.26,0.0,6.38,0.0,8.51,2.13,0.0,0.0,2.13,0.0,4.26,2.13,0.0,0.0,4.26,2.13,0.0,2.13,0.0,2.13,2.13,0.0,17.02,0.0,14.89,2.13,2.13,0.0,10.64,4.26,6.38,0.0,0.0,0.0,0.0
206,19308590.0,"George L. Rosario, REALTOR®",BIG_George_NYC,New York City,"Seen on NBC, FOX, NY1, ABC. Christian / Proud Dad / Realtor / Author / Keynote Speaker / #10X / #QLA / #GaryVee / Entrepreneur / New Yorker #glrosario",10802.0,8744.0,82.0,1/21/2009 0:21,18403.0,,23024.0,en,colton,"Mark, ALL of CNN's broadcasts are scripted. It is great seeing a young man come forward and actually say that HE was asked by CNN to ask scripted questions rather than his own questions. Thanks for sharing. Hey, when are you going to be in NYC? Coffee? #glrosario",Strong Agreement,4.0,59.0,9.67e+17,19308590.0,2/22/2018 0:16,7 days 09:46:05.000000000,7.0,3578 days 22:02:07.034922000,9.0,9,92.84,1.38,4.97,25.77,4.5,33.33,55.56,44.44,0.0,0.0,0.0,0.0,0.0,0.0,0.0,22.22,0.0,11.11,0.0,0.0,11.11,11.11,0.0,0.0,0.0,0.0,0.0,0.0,0.0,0.0,0.0,0.0,0.0,11.11,0.0,0.0,0.0,0.0,0.0,11.11,0.0,0.0,0.0,0.0,0.0,0.0,0.0,0.0,0.0,11.11,0.0,0.0,0.0,0.0,0.0,11.11,0.0,33.33,11.11,0.0,0.0,11.11,0.0,11.11
207,1467667345.0,nora tomlinson,runningnoodles,,,2146.0,3933.0,54.0,5/29/2013 0:16,3230.0,,35701.0,en,colton,"Nor did CNN bother with little niceties like disclosing that Tapper used to be the spox for Handgun Control, Inc.",Weak Agreement,3.0,60.0,9.67e+17,1467667345.0,2/22/2018 0:16,7 days 09:46:04.000000000,7.0,1989 days 22:07:12.034922000,5.0,48,66.38,92.75,23.51,99.0,8.0,18.75,81.25,45.83,10.42,6.25,0.0,2.08,4.17,0.0,4.17,2.08,14.58,10.42,6.25,4.17,0.0,27.08,6.25,2.08,2.08,0.0,2.08,6.25,6.25,0.0,0.0,18.75,6.25,12.5,4.17,0.0,2.08,4.17,2.08,6.25,4.17,2.08,2.08,4.17,2.08,0.0,0.0,2.08,4.17,16.67,2.08,12.5,6.25,4.17,6.25,0.0,2.08,18.75,6.25,4.17,4.17,0.0,2.08,2.08
208,4361398215.0,KOH,wabisabi8468,Canada,"Human #TheResistance
#standguard
Goodness Prevails
#metoo
The Demented Yam Will Go To Jail

#muelleriscoming",919.0,1535.0,2.0,12/3/2015 0:12,11642.0,,11809.0,en,colton,Wow you have your people trained...bullshitting heartfelt tweets..meanwhile hardcore Trump followers,Weak Disagreement,3.0,61.0,9.67e+17,4361398215.0,2/22/2018 0:15,7 days 09:45:57.000000000,7.0,1071 days 22:10:25.034922000,2.0,20,92.84,30.86,15.86,25.77,20.0,20.0,80.0,45.0,5.0,0.0,0.0,0.0,0.0,0.0,5.0,5.0,20.0,10.0,0.0,5.0,5.0,15.0,0.0,5.0,0.0,0.0,0.0,10.0,5.0,5.0,5.0,5.0,0.0,20.0,5.0,10.0,0.0,0.0,0.0,5.0,0.0,0.0,0.0,5.0,0.0,0.0,5.0,0.0,10.0,5.0,0.0,5.0,0.0,5.0,0.0,5.0,0.0,10.0,5.0,5.0,0.0,0.0,0.0,0.0
209,831869786.0,Bink,atxflyboy,,,575.0,563.0,1.0,9/18/2012 0:20,34938.0,,37033.0,en,colton,@IngrahamAngle @marklevinshow @SebGorka @seanhannity @LouDobbs @mitchellvii @Liz_Wheeler @foxandfriends @BreitbartNews @mitchellvii @dbongino @JackPosobiec @DLoesch,Neutral,4.0,62.0,9.67e+17,831869786.0,2/22/2018 0:13,7 days 09:43:38.000000000,7.0,2242 days 22:02:27.034922000,6.0,13,23.17,99.0,1.4,99.0,13.0,46.15,69.23,30.77,15.38,15.38,0.0,15.38,0.0,0.0,0.0,0.0,0.0,7.69,7.69,0.0,0.0,7.69,7.69,0.0,0.0,0.0,0.0,15.38,15.38,0.0,0.0,38.46,0.0,0.0,0.0,0.0,0.0,0.0,0.0,0.0,0.0,0.0,0.0,15.38,7.69,0.0,7.69,0.0,0.0,7.69,0.0,7.69,0.0,0.0,7.69,0.0,0.0,38.46,38.46,0.0,0.0,0.0,0.0,0.0
210,1078050246.0,Brian,texasbygrace,Texas by Grace,"#MAGA. End the senseless open borders & DACA. Supports Vets & Law Enforcement. If you kneel, better be for prayer. #Patriot #Conservative #KAG #KAG2020 #Veteran",9806.0,10189.0,17.0,1/11/2013 0:00,19460.0,,23090.0,en,colton,#ParklandStudentsSpeak not for all apparently. @cnn now picking on the elderly and kidos that won't have a hand pushing their #FakeNews narrative...,Strong Agreement,3.0,63.0,9.67e+17,1078050246.0,2/22/2018 0:12,7 days 09:42:13.000000000,7.0,2127 days 22:23:14.034922000,5.0,14,92.84,50.0,1.0,25.77,14.0,92.86,0.0,0.0,0.0,0.0,0.0,0.0,0.0,0.0,0.0,0.0,0.0,0.0,0.0,0.0,0.0,0.0,0.0,0.0,0.0,0.0,0.0,0.0,0.0,0.0,0.0,0.0,0.0,0.0,0.0,0.0,0.0,0.0,0.0,0.0,0.0,0.0,0.0,0.0,0.0,0.0,0.0,0.0,0.0,0.0,0.0,0.0,0.0,0.0,0.0,0.0,0.0,100.0,0.0,0.0,0.0,0.0,0.0,100.0
211,8.28e+17,Frances Barrera,FranBarreraReal,,I block trolls and vulgar types 😎🇺🇸,3396.0,727.0,10.0,2/4/2017 0:00,75436.0,,134160.0,en,colton,Not all of our young people are mind controlled Communist Crap  News Network shills,Strong Agreement,5.0,65.0,9.67e+17,8.28e+17,2/22/2018 0:11,7 days 09:41:32.000000000,7.0,642 days 22:23:23.034922000,1.0,22,43.68,18.16,31.94,25.77,11.0,31.82,72.73,54.55,9.09,4.55,0.0,0.0,0.0,4.55,4.55,9.09,9.09,9.09,9.09,4.55,9.09,18.18,0.0,0.0,0.0,0.0,4.55,0.0,0.0,0.0,0.0,4.55,0.0,18.18,0.0,4.55,0.0,4.55,4.55,4.55,4.55,0.0,4.55,0.0,0.0,0.0,0.0,0.0,0.0,9.09,4.55,13.64,4.55,4.55,4.55,0.0,0.0,36.36,18.18,0.0,0.0,0.0,4.55,13.64
212,7.3e+17,Julia.,jthebombdotcom,,"God, guns and America! #MAGA https://t.co/fjJU8yaV3q  ""Persistence always wins over resistance!""",5768.0,5815.0,1.0,5/11/2016 0:00,13409.0,,16980.0,en,colton,"How sad, CNN silencing victims who aren't to their liking, and chase down and harass elderly people.",Strong Agreement,5.0,66.0,9.67e+17,7.3e+17,2/22/2018 0:07,7 days 09:37:00.000000000,7.0,911 days 22:22:27.034922000,2.0,14,67.14,76.25,13.15,1.0,14.0,21.43,71.43,28.57,7.14,7.14,0.0,0.0,0.0,0.0,0.0,0.0,7.14,7.14,0.0,0.0,7.14,7.14,7.14,0.0,0.0,0.0,7.14,7.14,0.0,7.14,7.14,21.43,0.0,21.43,0.0,7.14,0.0,0.0,7.14,7.14,0.0,0.0,7.14,21.43,14.29,0.0,7.14,0.0,0.0,7.14,0.0,7.14,0.0,0.0,7.14,0.0,7.14,0.0,0.0,0.0,0.0,0.0,0.0,0.0
213,9.45e+17,Stefan ⚡,NLSTWLK,"Nijmegen, Nederland",,9.0,80.0,1.0,12/23/2017 0:21,256.0,,248.0,nl,colton,Cnn is fake,Strong Agreement,3.0,67.0,9.67e+17,9.45e+17,2/22/2018 0:06,7 days 09:36:58.000000000,7.0,320 days 22:01:39.034922000,0.0,17,14.53,72.17,6.2,1.0,17.0,17.65,82.35,47.06,11.76,5.88,0.0,0.0,0.0,5.88,5.88,0.0,11.76,5.88,5.88,17.65,5.88,11.76,5.88,0.0,11.76,0.0,0.0,23.53,5.88,17.65,5.88,17.65,0.0,11.76,0.0,5.88,0.0,0.0,0.0,5.88,5.88,0.0,0.0,11.76,0.0,0.0,11.76,0.0,0.0,5.88,0.0,5.88,0.0,5.88,0.0,0.0,0.0,23.53,5.88,11.76,0.0,0.0,5.88,0.0
214,4845831283.0,Tracie,TracieLiberty,"California, USA",Don't give Negan half of your stuff. What is the outrage of the day?,1614.0,1980.0,2.0,2/1/2016 0:18,17127.0,,7410.0,en,colton,Is anyone surprised?,Weak Agreement,3.0,69.0,9.67e+17,4845831283.0,2/22/2018 0:06,7 days 09:36:33.000000000,7.0,1011 days 22:04:32.034922000,2.0,3,17.96,50.0,1.0,1.0,3.0,0.0,66.67,33.33,0.0,0.0,0.0,0.0,0.0,0.0,0.0,0.0,0.0,33.33,0.0,0.0,0.0,33.33,33.33,0.0,0.0,0.0,0.0,33.33,0.0,33.33,0.0,0.0,0.0,0.0,0.0,0.0,0.0,0.0,0.0,0.0,0.0,0.0,0.0,0.0,0.0,0.0,0.0,0.0,0.0,33.33,0.0,0.0,0.0,0.0,0.0,0.0,0.0,0.0,0.0,0.0,0.0,0.0,0.0,0.0
215,7.04e+17,BigPete87,big_pete87,,,76.0,295.0,1.0,2/29/2016 0:20,8479.0,,879.0,en,colton,CNN fake news,Strong Agreement,4.0,71.0,9.67e+17,7.04e+17,2/22/2018 0:06,7 days 09:36:18.000000000,7.0,983 days 22:03:03.034922000,2.0,3,1.0,99.0,1.0,99.0,3.0,33.33,100.0,66.67,33.33,0.0,0.0,0.0,0.0,0.0,33.33,0.0,0.0,33.33,0.0,0.0,0.0,33.33,33.33,0.0,0.0,0.0,0.0,33.33,33.33,0.0,0.0,33.33,0.0,33.33,0.0,0.0,0.0,33.33,0.0,0.0,0.0,0.0,0.0,0.0,0.0,0.0,0.0,0.0,0.0,33.33,0.0,0.0,0.0,0.0,0.0,0.0,0.0,33.33,0.0,0.0,33.33,0.0,0.0,0.0
216,3950218941.0,Cynthia McGrath,CynthiaMcGrath6,,"Conservative, Insurance Broker/Consultant by day, Entertainer by night. #MAGA always up for a lively debate/conversation. Vulgar keyboard warriors blocked",1038.0,928.0,3.0,10/13/2015 0:22,53290.0,,9092.0,en,colton,"There s hope yet. This critical & logical thinker who can stand on his own two feet, will go far. Go JrROTC!",Strong Agreement,3.0,72.0,9.67e+17,3950218941.0,2/22/2018 0:06,7 days 09:36:17.000000000,7.0,1122 days 22:01:07.034922000,3.0,3,92.84,50.0,1.0,1.0,3.0,0.0,33.33,0.0,0.0,0.0,0.0,0.0,0.0,0.0,0.0,0.0,0.0,0.0,0.0,0.0,0.0,0.0,33.33,0.0,0.0,0.0,0.0,33.33,0.0,33.33,0.0,0.0,0.0,0.0,0.0,0.0,0.0,0.0,0.0,0.0,0.0,0.0,0.0,0.0,0.0,0.0,0.0,0.0,0.0,0.0,0.0,0.0,0.0,0.0,0.0,0.0,0.0,0.0,0.0,0.0,0.0,0.0,0.0,0.0
217,7.69e+17,🇺🇸Based Mississippi🇺🇸,JOHNBOSS187,Swamps ,#TRUMP is my president can’t stand a soft butt socialist. i lack feeling and have a whole lot of common sense. #MAGA 🇺🇸 I am not a Russian bot. #BlueEyeDevil,540.0,759.0,14.0,8/27/2016 0:05,11265.0,,9780.0,en,colton,#PatriotColtonHaab,Strong Agreement,4.0,73.0,9.67e+17,7.69e+17,2/22/2018 0:06,7 days 09:36:05.000000000,7.0,803 days 22:17:33.034922000,2.0,21,28.22,82.96,68.01,25.77,7.0,14.29,80.95,38.1,14.29,4.76,0.0,0.0,4.76,0.0,9.52,0.0,4.76,9.52,9.52,0.0,0.0,19.05,4.76,0.0,4.76,4.76,0.0,9.52,4.76,4.76,4.76,9.52,4.76,14.29,9.52,0.0,4.76,4.76,0.0,0.0,0.0,0.0,4.76,0.0,0.0,0.0,0.0,0.0,0.0,19.05,9.52,23.81,9.52,9.52,4.76,0.0,0.0,23.81,9.52,4.76,0.0,4.76,0.0,4.76
218,7.69e+17,🇺🇸Based Mississippi🇺🇸,JOHNBOSS187,Swamps ,#TRUMP is my president can’t stand a soft butt socialist. i lack feeling and have a whole lot of common sense. #MAGA 🇺🇸 I am not a Russian bot. #BlueEyeDevil,540.0,759.0,14.0,8/27/2016 0:05,11265.0,,9780.0,en,colton,@marcorubio you got played,Neutral,3.0,73.0,9.67e+17,7.69e+17,2/22/2018 0:06,7 days 09:36:05.000000000,7.0,803 days 22:17:33.034922000,2.0,1,92.84,50.0,1.0,25.77,1.0,100.0,0.0,0.0,0.0,0.0,0.0,0.0,0.0,0.0,0.0,0.0,0.0,0.0,0.0,0.0,0.0,0.0,0.0,0.0,0.0,0.0,0.0,0.0,0.0,0.0,0.0,0.0,0.0,0.0,0.0,0.0,0.0,0.0,0.0,0.0,0.0,0.0,0.0,0.0,0.0,0.0,0.0,0.0,0.0,0.0,0.0,0.0,0.0,0.0,0.0,0.0,0.0,100.0,0.0,0.0,0.0,0.0,0.0,100.0
219,714673099.0,#EverybodyIn,CubsRSpiritual,West Olive Mi,"Go Cubs Go! Pro photographer Hatred for Ohio,MSU,St.Louis,& White Sox runs deep ! My opinions & views are mine alone no apologies.",480.0,862.0,14.0,7/24/2012 0:17,910.0,,3247.0,en,colton,Does this really shock anyone ? The Liberal media actually wants to script an event & control its participants with its own propaganda? #Liberals #CNNTownHall #ParklandStudentsSpeak #GunControlNow,Strong Agreement,3.0,74.0,9.67e+17,714673099.0,2/22/2018 0:05,7 days 09:35:57.000000000,7.0,2298 days 22:05:33.034922000,6.0,4,37.39,99.0,1.0,99.0,4.0,25.0,75.0,25.0,25.0,25.0,0.0,25.0,0.0,0.0,0.0,0.0,0.0,0.0,0.0,0.0,0.0,50.0,0.0,0.0,0.0,0.0,0.0,25.0,25.0,0.0,0.0,25.0,0.0,0.0,0.0,0.0,0.0,0.0,0.0,0.0,0.0,0.0,0.0,25.0,0.0,0.0,0.0,25.0,50.0,0.0,0.0,0.0,0.0,0.0,0.0,0.0,0.0,25.0,0.0,0.0,0.0,0.0,0.0,25.0
220,7.74e+17,John Chrysostom,googoo__3,"Union City, NJ",,202.0,723.0,0.0,9/10/2016 0:00,6325.0,,6319.0,en,colton,"utterly ridiculous,,,,",Neutral,3.0,75.0,9.67e+17,7.74e+17,2/22/2018 0:05,7 days 09:35:48.000000000,7.0,789 days 22:23:11.034922000,2.0,25,72.8,50.0,1.59,1.0,8.33,36.0,64.0,44.0,16.0,0.0,0.0,0.0,0.0,0.0,16.0,8.0,8.0,4.0,8.0,0.0,0.0,8.0,0.0,0.0,0.0,0.0,0.0,4.0,0.0,4.0,0.0,8.0,0.0,20.0,0.0,4.0,4.0,4.0,0.0,8.0,0.0,0.0,0.0,4.0,0.0,0.0,4.0,0.0,0.0,8.0,4.0,4.0,0.0,0.0,4.0,0.0,0.0,28.0,0.0,0.0,8.0,0.0,0.0,20.0
221,8.96e+17,Artie Vandelay,ArtieVandelay1,,"Concerned citizen, believer that all people should be treated equally, 45 must go, proud member of #TheResistance #Resist #FBR",7032.0,6606.0,8.0,8/12/2017 0:20,18559.0,,11131.0,en,colton,Yikes.,Neutral,3.0,77.0,9.67e+17,8.96e+17,2/24/2018 0:12,9 days 09:42:38.000000000,9.0,453 days 22:03:11.034922000,1.0,2,92.84,50.0,1.0,1.0,2.0,100.0,50.0,0.0,0.0,0.0,0.0,0.0,0.0,0.0,0.0,0.0,0.0,0.0,0.0,0.0,0.0,0.0,0.0,0.0,0.0,0.0,0.0,50.0,0.0,50.0,50.0,0.0,0.0,0.0,0.0,0.0,0.0,0.0,0.0,0.0,0.0,0.0,0.0,0.0,0.0,0.0,0.0,0.0,0.0,0.0,0.0,0.0,0.0,0.0,0.0,0.0,0.0,200.0,0.0,200.0,0.0,0.0,0.0,0.0
222,2478348222.0,❤️TRUMP 🇺🇸 MAGA,TrumpHappiest,"California, USA","🇺🇸Feisty Conservative in California. Dad-WWII fighter pilot. #USAF Reaganite! Trumplican! 🙏 4 our Soldiers, our Men in Blue, & #POTUS! #NoDACA 🔫 #NRA #2A",4007.0,3259.0,16.0,5/5/2014 0:13,14276.0,,19498.0,en,colton,"I do have to say, every student who I have heard speak from this school has been very articulate! Very good school and excellent parenting!",Neutral,3.0,78.0,9.67e+17,2478348222.0,2/23/2018 0:12,8 days 09:42:09.000000000,8.0,1648 days 22:10:06.034922000,4.0,1,92.84,50.0,1.0,25.77,1.0,0.0,0.0,0.0,0.0,0.0,0.0,0.0,0.0,0.0,0.0,0.0,0.0,0.0,0.0,0.0,0.0,0.0,0.0,0.0,0.0,0.0,0.0,0.0,0.0,0.0,0.0,0.0,0.0,0.0,0.0,0.0,0.0,0.0,0.0,0.0,0.0,0.0,0.0,0.0,0.0,0.0,0.0,0.0,0.0,0.0,0.0,0.0,0.0,0.0,0.0,0.0,0.0,100.0,100.0,0.0,0.0,0.0,0.0,0.0
223,185170090.0,Benny Xavier,talkingdeer,,"Follower of Jesus,  Positive, loves sunshine, brightly lit places, fresh air, sea, space, forests, people, simple, food from all around the world. No attitude",65.0,311.0,0.0,8/31/2010 0:11,13.0,,782.0,en,colton,No wonder they are called the Crap News Network.,Strong Agreement,3.0,79.0,9.67e+17,185170090.0,2/23/2018 0:08,8 days 09:38:41.000000000,8.0,2991 days 22:11:48.034922000,8.0,25,8.19,88.48,1.59,99.0,12.5,16.0,96.0,56.0,16.0,8.0,8.0,0.0,0.0,0.0,8.0,0.0,8.0,20.0,8.0,4.0,0.0,32.0,0.0,0.0,4.0,0.0,4.0,8.0,8.0,0.0,0.0,20.0,0.0,4.0,0.0,0.0,0.0,0.0,4.0,0.0,12.0,0.0,0.0,16.0,4.0,4.0,4.0,4.0,8.0,24.0,0.0,0.0,0.0,0.0,0.0,16.0,0.0,12.0,0.0,4.0,0.0,8.0,0.0,0.0
224,7.09e+17,D,DerekC2016,In Your Head,President Trump is a leader & results oriented. AMERICA FIRST! I am sending $ directly to Trump & not the GOP. MAGA Semper fi,7079.0,7172.0,58.0,3/14/2016 0:17,39818.0,,70362.0,en,colton,More censorship!!!,Strong Agreement,3.0,80.0,9.67e+17,7.09e+17,2/22/2018 0:09,7 days 09:39:30.000000000,7.0,969 days 22:06:08.034922000,2.0,9,45.11,50.0,4.97,1.0,9.0,11.11,77.78,44.44,11.11,11.11,0.0,0.0,0.0,11.11,0.0,11.11,0.0,11.11,0.0,0.0,11.11,33.33,0.0,0.0,0.0,0.0,0.0,11.11,0.0,11.11,11.11,22.22,0.0,11.11,11.11,0.0,0.0,11.11,0.0,0.0,0.0,0.0,11.11,0.0,0.0,0.0,0.0,0.0,11.11,22.22,0.0,0.0,0.0,0.0,0.0,0.0,11.11,11.11,11.11,0.0,0.0,0.0,0.0,0.0
225,2212213908.0,Brian,dualisticmonist,,"Joined Twitter just to follow Shakira, but then it turned into an epic crusade to rid the world of Deep State pedophiles and their Satanic overlords.
Who knew?",737.0,98.0,17.0,11/24/2013 0:09,71725.0,,11394.0,en,colton,"CNN is ""the enemy of the people.""

Truer words have never been spoken.",Strong Agreement,6.0,81.0,9.67e+17,2212213908.0,2/22/2018 0:08,7 days 09:38:13.000000000,7.0,1810 days 22:13:42.034922000,4.0,2,92.84,50.0,1.0,25.77,2.0,50.0,50.0,0.0,0.0,0.0,0.0,0.0,0.0,0.0,0.0,0.0,0.0,0.0,0.0,0.0,0.0,0.0,50.0,50.0,0.0,0.0,50.0,0.0,0.0,0.0,0.0,0.0,0.0,0.0,0.0,0.0,0.0,0.0,0.0,0.0,0.0,0.0,0.0,0.0,0.0,0.0,0.0,0.0,0.0,0.0,0.0,0.0,0.0,0.0,0.0,0.0,0.0,150.0,0.0,0.0,0.0,150.0,0.0,0.0
226,2822558919.0,KFriend,kimberly010960,,"President Trump and VP Pence #MAGA2017 
HUGE AZ CARDINALS FAN 🏈 They don't kneel.",3971.0,4696.0,63.0,10/11/2014 0:12,18135.0,,74673.0,en,colton,God Bless this kid. Get this out there! Rt,Strong Agreement,3.0,82.0,9.67e+17,2822558919.0,2/22/2018 0:07,7 days 09:37:58.000000000,7.0,1489 days 22:11:19.034922000,4.0,13,64.27,93.79,1.4,25.77,6.5,0.0,84.62,53.85,0.0,0.0,0.0,0.0,0.0,0.0,0.0,15.38,7.69,23.08,7.69,0.0,7.69,30.77,7.69,7.69,0.0,0.0,0.0,15.38,7.69,7.69,7.69,23.08,0.0,7.69,0.0,0.0,0.0,0.0,7.69,0.0,7.69,0.0,0.0,0.0,0.0,0.0,0.0,0.0,15.38,15.38,0.0,7.69,0.0,0.0,7.69,0.0,0.0,30.77,15.38,0.0,0.0,0.0,0.0,0.0
227,2950833896.0,adela lyle,ubaserious,,"Website soon called KJVQuickGuides memory notes excerpts from great pastors using the preserved Word of God, the Authorised King James Bible KJV",295.0,459.0,1.0,12/29/2014 0:19,3268.0,,3303.0,en-gb,colton,Good on this young man for standing up for facts. Makes my heart sing. Go Go Second Amendment. Let @realDonaldTrump not waiver against his voters and the world that looks upon eager to have him as president too :),Strong Agreement,4.0,83.0,9.67e+17,2950833896.0,2/22/2018 0:06,7 days 09:36:54.000000000,7.0,1410 days 22:03:47.034922000,3.0,9,45.11,98.62,4.97,99.0,3.0,0.0,100.0,44.44,22.22,0.0,0.0,0.0,0.0,0.0,22.22,0.0,11.11,0.0,11.11,0.0,0.0,11.11,0.0,0.0,0.0,0.0,0.0,11.11,11.11,0.0,0.0,22.22,0.0,0.0,0.0,0.0,0.0,0.0,0.0,0.0,0.0,0.0,0.0,33.33,0.0,0.0,22.22,11.11,0.0,11.11,0.0,11.11,0.0,11.11,0.0,0.0,11.11,22.22,11.11,0.0,0.0,11.11,0.0,0.0
228,3302755158.0,Bryce,Brycebe57479283,"Arizona, USA","raised in Wyoming listening to Johnny Cash , Charlie Pride, Steppenwolf and Frank Zappa , Hero’s are Glenn Ford  and Peter Fonda and most of all President Trump",175.0,335.0,3.0,7/31/2015 0:22,1128.0,,4616.0,en,colton,No big surprise there #FakeNewsCNN a one sided scripted town hall @realDonaldTrump the real town hall in the White House,Strong Agreement,3.0,84.0,9.67e+17,3302755158.0,2/22/2018 0:06,7 days 09:36:25.000000000,7.0,1196 days 22:00:43.034922000,3.0,39,86.39,39.87,46.75,99.0,9.75,12.82,87.18,48.72,12.82,7.69,2.56,0.0,5.13,0.0,5.13,2.56,20.51,5.13,2.56,5.13,2.56,17.95,7.69,2.56,0.0,2.56,0.0,7.69,7.69,0.0,0.0,7.69,7.69,10.26,0.0,2.56,0.0,0.0,2.56,5.13,5.13,2.56,2.56,10.26,0.0,0.0,5.13,5.13,0.0,15.38,0.0,17.95,5.13,10.26,2.56,2.56,2.56,10.26,7.69,0.0,0.0,0.0,0.0,2.56
229,2246299058.0,Paul Hookem 🇺🇸,PaulHook_em,,"🇺🇸PAULHOOKEM'S Official Page🇺🇸Politics, sports, crypto and other ramblings. #JesusChrist #MAGA #Longhorns #FreeThinker #Patriot  🇺🇸🤘🏽",40735.0,33909.0,124.0,12/14/2013 0:23,75827.0,,12197.0,en,colton,@seanhannity,Neutral,3.0,85.0,9.67e+17,2246299058.0,2/22/2018 0:06,7 days 09:36:22.000000000,7.0,1790 days 21:59:51.034922000,4.0,20,98.46,30.86,93.3,96.76,20.0,20.0,75.0,30.0,0.0,0.0,0.0,0.0,0.0,0.0,0.0,15.0,5.0,0.0,5.0,0.0,5.0,0.0,10.0,0.0,0.0,5.0,0.0,5.0,5.0,0.0,0.0,0.0,0.0,0.0,0.0,0.0,0.0,0.0,0.0,0.0,5.0,5.0,0.0,5.0,0.0,0.0,5.0,0.0,0.0,0.0,0.0,30.0,0.0,30.0,0.0,0.0,0.0,10.0,0.0,0.0,0.0,0.0,0.0,10.0
230,7.6e+17,Heddi,SmithHeddi,America is experiencing a #GreatAWAKENING!  Open your eyes!,"#WWG1WGA   #MAGA 
#ENDTrafficking  #ANTIglobalism  #StrongBorders #STOPcensorship #Q  #Qanon #MarkTaylor
#RightToLife 
Love God & the great USA!  
Love my POTUS",841.0,455.0,7.0,7/31/2016 0:18,36451.0,,13305.0,en,colton,Glad to see this kid had a mind of his own!,Strong Agreement,4.0,87.0,9.67e+17,7.6e+17,2/22/2018 0:06,7 days 09:36:19.000000000,7.0,830 days 22:05:19.034922000,2.0,1,92.84,50.0,1.0,25.77,1.0,100.0,0.0,0.0,0.0,0.0,0.0,0.0,0.0,0.0,0.0,0.0,0.0,0.0,0.0,0.0,0.0,0.0,0.0,0.0,0.0,0.0,0.0,0.0,0.0,0.0,0.0,0.0,0.0,0.0,0.0,0.0,0.0,0.0,0.0,0.0,0.0,0.0,0.0,0.0,0.0,0.0,0.0,0.0,0.0,0.0,0.0,0.0,0.0,0.0,0.0,0.0,0.0,100.0,0.0,0.0,0.0,0.0,0.0,100.0
231,39760608.0,Dangerfield,Aztatude,My Chitty Tweets 👇💩👇 Enjoy!,"Wow, you know how to click a profile button & read. Whoopty friggin do! Here's your trophy 🏆. BTW I luv F-ing w/grammar cops.

When banned I'm
@ElDiabl91135435",585.0,852.0,2.0,5/13/2009 0:14,8243.0,,9817.0,en,colton,Figured this was going on cause it is a CNN Town Hall. Surprised they didn't give the sheriff the questions ahead of time.,Weak Agreement,3.0,88.0,9.67e+17,39760608.0,2/22/2018 0:06,7 days 09:36:16.000000000,7.0,3466 days 22:08:54.034922000,9.0,11,92.84,96.52,1.0,99.0,11.0,0.0,81.82,54.55,18.18,9.09,0.0,0.0,9.09,0.0,9.09,9.09,18.18,9.09,0.0,0.0,0.0,18.18,9.09,0.0,0.0,0.0,0.0,9.09,9.09,0.0,0.0,18.18,9.09,0.0,0.0,0.0,0.0,0.0,0.0,0.0,9.09,9.09,0.0,9.09,0.0,0.0,9.09,0.0,9.09,9.09,0.0,0.0,0.0,0.0,0.0,0.0,0.0,9.09,0.0,0.0,0.0,9.09,0.0,0.0
232,7.17e+17,Kathy Podgers,kathypodgers,,Tweets are not endorsements,625.0,780.0,1.0,4/5/2016 0:17,10944.0,,10925.0,en,colton,What a brave young man! Hope he will be a leader some day.,Strong Agreement,3.0,89.0,9.67e+17,7.17e+17,2/22/2018 0:06,7 days 09:36:13.000000000,7.0,947 days 22:06:06.034922000,2.0,23,87.57,50.0,99.0,93.61,11.5,17.39,91.3,52.17,13.04,4.35,0.0,0.0,0.0,4.35,8.7,13.04,13.04,13.04,0.0,0.0,4.35,21.74,4.35,0.0,0.0,0.0,0.0,4.35,4.35,0.0,0.0,8.7,0.0,17.39,8.7,4.35,0.0,4.35,0.0,4.35,0.0,0.0,0.0,4.35,0.0,4.35,0.0,0.0,8.7,8.7,8.7,26.09,4.35,13.04,8.7,0.0,0.0,13.04,8.7,0.0,0.0,0.0,4.35,0.0
233,2304075671.0,Anne Louise 💙,village_jordan,Massachusettes USA,"Daughter of American Revolution
Writer, Potion Maker, Scapegoat...
Widow of Disabled Vet",2892.0,2856.0,6.0,1/25/2014 0:18,69065.0,,34881.0,en,colton,You must fit the CNN Communist News Network  narrative Dear,Strong Agreement,4.0,90.0,9.67e+17,2304075671.0,2/22/2018 0:06,7 days 09:36:13.000000000,7.0,1748 days 22:04:31.034922000,4.0,13,64.27,98.93,1.0,99.0,6.5,0.0,100.0,46.15,15.38,7.69,0.0,0.0,7.69,0.0,7.69,15.38,0.0,15.38,0.0,0.0,0.0,23.08,7.69,0.0,7.69,0.0,7.69,15.38,15.38,0.0,0.0,23.08,15.38,15.38,0.0,0.0,7.69,15.38,0.0,0.0,0.0,0.0,0.0,7.69,0.0,7.69,7.69,0.0,0.0,15.38,15.38,15.38,0.0,0.0,15.38,7.69,0.0,15.38,7.69,0.0,0.0,7.69,0.0,0.0
234,804149264.0,Gregory Miller,Gregory52230449,"Portland, OR",Alive and kicking,1761.0,2921.0,7.0,9/5/2012 0:08,6736.0,,12255.0,en,colton,Of course they would.,Strong Agreement,3.0,91.0,9.67e+17,804149264.0,2/22/2018 0:06,7 days 09:36:07.000000000,7.0,2255 days 22:14:56.034922000,6.0,10,77.33,99.0,1.0,99.0,10.0,30.0,60.0,30.0,10.0,10.0,0.0,10.0,0.0,0.0,0.0,10.0,0.0,10.0,0.0,0.0,0.0,10.0,0.0,0.0,0.0,0.0,0.0,10.0,10.0,0.0,0.0,30.0,0.0,10.0,0.0,0.0,10.0,0.0,10.0,0.0,0.0,0.0,0.0,20.0,20.0,0.0,0.0,0.0,0.0,0.0,0.0,10.0,0.0,10.0,0.0,0.0,0.0,0.0,0.0,0.0,0.0,0.0,0.0,0.0
235,8.26e+17,Army 🇺🇲,ArnoldofBmore,"Philadelphia, PA",Your feelings are meaningless.,46.0,14.0,0.0,1/30/2017 0:07,7057.0,,1061.0,en,colton,There is hope yet.,Weak Agreement,3.0,92.0,9.67e+17,8.26e+17,2/22/2018 0:05,7 days 09:35:53.000000000,7.0,647 days 22:15:57.034922000,1.0,4,37.39,99.0,1.0,25.77,4.0,0.0,100.0,75.0,25.0,25.0,0.0,0.0,0.0,25.0,0.0,0.0,25.0,25.0,0.0,0.0,0.0,25.0,0.0,0.0,0.0,0.0,0.0,0.0,0.0,0.0,0.0,25.0,0.0,25.0,0.0,0.0,25.0,0.0,0.0,0.0,0.0,0.0,0.0,0.0,0.0,0.0,0.0,0.0,0.0,0.0,0.0,0.0,0.0,0.0,0.0,25.0,0.0,25.0,25.0,0.0,0.0,0.0,0.0,0.0
236,9.31e+17,Trump Republican,CommonGOPvoter,"California, USA","Current student, political junkie, intellectual, and a staunch Republican in the deep blue state of California. 🐻 🐘 #MAGA #Trump2020 #Patriot",754.0,611.0,14.0,11/17/2017 0:06,5268.0,,5518.0,en,colton,I KNEW IT WAS STAGED!,Strong Agreement,4.0,93.0,9.67e+17,9.31e+17,2/22/2018 0:05,7 days 09:35:52.000000000,7.0,356 days 22:17:13.034922000,0.0,4,1.0,50.0,1.0,99.0,4.0,0.0,100.0,75.0,0.0,0.0,0.0,0.0,0.0,0.0,0.0,0.0,0.0,25.0,50.0,0.0,0.0,50.0,0.0,0.0,0.0,0.0,0.0,25.0,25.0,0.0,0.0,0.0,0.0,25.0,0.0,0.0,25.0,25.0,0.0,0.0,0.0,0.0,0.0,0.0,0.0,0.0,0.0,0.0,0.0,50.0,25.0,25.0,0.0,0.0,25.0,0.0,0.0,25.0,25.0,0.0,0.0,0.0,0.0,0.0
