,id,name,screen_name,location,description,followers_count,friends_count,listed_count,created_time,favorites_count,timezone,statuses_count,language,topic,text,stance,count,Unnamed: 0,tweet_id,user_id,time,publishing_time,publishing_days,membership_age,membership_years,WC,Analytic,Clout,Authentic,Tone,WPS,Sixltr,Dic,function,pronoun,ppron,i,you,shehe,they,ipron,article,prep,auxverb,adverb,conj,negate,verb,adj,compare,interrog,number,quant,affect,posemo,negemo,anger,social,male,cogproc,insight,cause,discrep,tentat,certain,differ,percept,see,bio,drives,affiliation,achieve,power,reward,focuspast,focuspresent,focusfuture,relativ,motion,space,time.1,work,informal,AllPunc,Period,Comma,QMark,Exclam,Apostro,OtherP
377,206803941.0,Tapia Corel,TapiaCorel,Los Angeles,Times are changing so it's time for action. Still singing but takin' it to the streets for now.,50.0,96.0,4.0,10/23/2010 0:19,1827.0,,4514.0,en,FBI,"Why don't you so something as significant, or are you incapable and can only be a parasite, feeding off of others' achievements? Hmmmm?",Neutral,3.0,95.0,9.66e+17,206803941.0,2/21/2018 0:15,6 days 09:45:47.000000000,6.0,2938 days 22:04:01.034922000,8.0,13,1.0,99.0,1.0,25.77,4.33,15.38,76.92,61.54,30.77,23.08,0.0,23.08,0.0,0.0,7.69,0.0,7.69,7.69,15.38,7.69,0.0,15.38,7.69,7.69,0.0,0.0,0.0,15.38,7.69,7.69,0.0,23.08,0.0,7.69,0.0,7.69,0.0,0.0,0.0,0.0,0.0,0.0,0.0,0.0,0.0,0.0,0.0,0.0,0.0,15.38,0.0,0.0,0.0,0.0,0.0,0.0,0.0,276.92,0.0,0.0,276.92,0.0,0.0,0.0
378,19342389.0,john murphy,murphstix,"Tyler,Texas","I am married (35 yrs.) father of two, grandfather of four, avid drummer with local artists..MAGA🇺🇸",891.0,914.0,2.0,1/22/2009 0:15,6967.0,,12121.0,en,FBI,Bigger question...how stupid do they think everyone is?,Strong Agreement,5.0,97.0,9.66e+17,19342389.0,2/21/2018 0:14,6 days 09:44:30.000000000,6.0,3577 days 22:08:04.034922000,9.0,23,1.23,66.81,9.25,25.77,11.5,26.09,91.3,73.91,17.39,8.7,0.0,8.7,0.0,0.0,8.7,4.35,13.04,17.39,13.04,17.39,4.35,13.04,4.35,4.35,4.35,0.0,0.0,0.0,0.0,0.0,0.0,8.7,0.0,17.39,0.0,4.35,0.0,8.7,0.0,8.7,0.0,0.0,4.35,8.7,0.0,8.7,4.35,4.35,0.0,17.39,0.0,4.35,0.0,4.35,0.0,4.35,4.35,26.09,0.0,8.7,8.7,0.0,8.7,0.0
379,2167274451.0,AKW,StateofBall,,,83.0,265.0,0.0,11/4/2013 0:01,8871.0,,3256.0,en,FBI,Yâall are psychotic to believe this,Strong Disagreement,6.0,99.0,9.66e+17,2167274451.0,2/21/2018 0:13,6 days 09:43:04.000000000,6.0,1830 days 22:21:33.034922000,5.0,9,1.0,99.0,98.01,1.0,9.0,22.22,100.0,55.56,22.22,11.11,0.0,0.0,0.0,11.11,11.11,0.0,0.0,22.22,11.11,11.11,0.0,33.33,22.22,11.11,11.11,0.0,0.0,11.11,0.0,11.11,11.11,33.33,0.0,44.44,22.22,11.11,0.0,11.11,11.11,0.0,0.0,0.0,0.0,11.11,0.0,0.0,11.11,0.0,0.0,33.33,0.0,11.11,0.0,11.11,0.0,0.0,0.0,44.44,33.33,0.0,11.11,0.0,0.0,0.0
380,7.98e+17,TheRedMantis,TheRedMantisEye,"Jub - i - LEE, One demand",AntiWar is AntiBank. #Usurocrocy #FairMinMaxIncome #BankWar #Strike #MakeFEDPublicBank #LocalFarm #CleanWater #Crypto #21TrillionMIA #IsraelTerrorist🇵🇸,436.0,1233.0,7.0,11/12/2016 0:20,8213.0,,13355.0,en,FBI,https://twitter.com/chiweethedog/status/966179087717892096 â¦,Neutral,6.0,100.0,9.66e+17,7.98e+17,2/21/2018 0:11,6 days 09:41:56.000000000,6.0,726 days 22:02:28.034922000,1.0,7,67.14,50.0,13.15,25.77,7.0,28.57,71.43,42.86,14.29,0.0,0.0,0.0,0.0,0.0,14.29,0.0,14.29,14.29,0.0,0.0,0.0,28.57,0.0,0.0,0.0,0.0,14.29,0.0,0.0,0.0,0.0,0.0,0.0,28.57,14.29,0.0,0.0,0.0,14.29,0.0,0.0,0.0,0.0,0.0,0.0,0.0,0.0,0.0,0.0,28.57,0.0,0.0,0.0,0.0,0.0,0.0,0.0,0.0,0.0,0.0,0.0,0.0,0.0,0.0
381,1055761406.0,Pat Gunn,patgunn66,,,35.0,128.0,0.0,1/2/2013 0:18,845.0,,2348.0,en,FBI,Has anyone verified that David Hogg or any of those kids are actually students at the school?,Neutral,3.0,102.0,9.66e+17,1055761406.0,2/21/2018 0:07,6 days 09:37:49.000000000,6.0,2136 days 22:05:04.034922000,5.0,8,92.84,89.42,1.0,25.77,8.0,25.0,37.5,0.0,0.0,0.0,0.0,0.0,0.0,0.0,0.0,0.0,0.0,0.0,0.0,0.0,0.0,0.0,0.0,0.0,0.0,12.5,0.0,0.0,0.0,0.0,0.0,12.5,0.0,0.0,0.0,0.0,0.0,0.0,0.0,0.0,0.0,0.0,0.0,25.0,12.5,0.0,12.5,0.0,0.0,0.0,0.0,0.0,0.0,0.0,0.0,0.0,25.0,75.0,12.5,0.0,0.0,0.0,0.0,62.5
382,63827798.0,Jeffrey Shallit,shallit43,"Kitchener, Ontario",Grumpy old American mathematician and computer scientist.  All tweets are my opinion and my opinion only.  Trump must be impeached.,143.0,172.0,8.0,8/7/2009 0:21,1762.0,,10041.0,en,FBI,Just when you though the crazy Republicans couldn't go any lower...,Strong Disagreement,4.0,104.0,9.66e+17,63827798.0,2/21/2018 0:06,6 days 09:36:46.000000000,6.0,3380 days 22:02:12.034922000,9.0,17,41.45,50.0,28.81,25.77,17.0,17.65,82.35,58.82,17.65,0.0,0.0,0.0,0.0,0.0,17.65,5.88,11.76,11.76,5.88,5.88,0.0,11.76,0.0,0.0,0.0,0.0,5.88,0.0,0.0,0.0,0.0,11.76,0.0,23.53,0.0,0.0,0.0,17.65,0.0,11.76,0.0,0.0,0.0,5.88,0.0,0.0,5.88,0.0,0.0,11.76,0.0,5.88,0.0,5.88,0.0,11.76,0.0,5.88,0.0,0.0,5.88,0.0,0.0,0.0
383,42749187.0,Jeffrey Hayes Frye,JeffreyFrye,"Crystal Lake, IL","I am a passionate follower of YeHoVaH and his son Yashua(Jesus). I speak only in #Truth. I love to help people, serve them, and grow :) #MAGA #KAG #ΜΟΛΩΝΛΑΒΕ #Q",3809.0,4938.0,7.0,5/26/2009 0:23,5833.0,,3885.0,en,FBI,"Oh, and let's not forget to take everyone's mind over the FBI's responsibility for #Parkland. Let's curb the FBI's power not the people's granted to them by the Constitution.",Neutral,3.0,106.0,9.66e+17,42749187.0,2/21/2018 0:06,6 days 09:36:13.000000000,6.0,3453 days 22:00:20.034922000,9.0,11,1.0,50.0,85.21,1.0,11.0,18.18,90.91,54.55,9.09,9.09,0.0,9.09,0.0,0.0,0.0,9.09,0.0,9.09,27.27,18.18,9.09,18.18,18.18,9.09,9.09,0.0,9.09,18.18,0.0,18.18,0.0,9.09,0.0,27.27,0.0,0.0,9.09,9.09,0.0,9.09,0.0,0.0,0.0,9.09,0.0,0.0,9.09,0.0,0.0,9.09,0.0,27.27,9.09,9.09,9.09,0.0,0.0,36.36,27.27,0.0,0.0,0.0,9.09,0.0
384,9.6e+17,mahree moyle,PutinPlants,"California, USA","Tracking down Poison Putin Plants. Careful voting Putin can run his guys as Dems. Author of ""The Kennedy Half Dollar"" true crime/a lot of ""me too""",689.0,1125.0,0.0,2/2/2018 0:19,3434.0,,4418.0,en,FBI,Someone told me he goes by Lucian Einhorn. They also said every place he's been assoc. with has had the Federal Emergency Mngmt. Investigating. Mr. Einhorn sounds like a bad boy.,Strong Agreement,3.0,107.0,9.66e+17,9.6e+17,2/21/2018 0:06,6 days 09:36:04.000000000,6.0,279 days 22:04:20.034922000,0.0,29,97.44,84.96,3.81,25.77,14.5,20.69,79.31,55.17,13.79,10.34,0.0,0.0,0.0,3.45,3.45,13.79,17.24,0.0,0.0,3.45,6.9,13.79,0.0,0.0,0.0,0.0,0.0,0.0,0.0,0.0,0.0,17.24,0.0,10.34,0.0,0.0,0.0,0.0,3.45,6.9,0.0,0.0,0.0,20.69,6.9,0.0,6.9,3.45,0.0,13.79,0.0,3.45,0.0,3.45,0.0,3.45,3.45,34.48,6.9,3.45,0.0,0.0,20.69,3.45
385,841777388.0,james j burke III,jamesjburkeIII,,,1510.0,1503.0,8.0,9/23/2012 0:14,30707.0,,155975.0,en,FBI,If the FBI knew before hand about the Boston bombing and other school shootings then why did the let ppl die & suffer unless they are pushing to take out guns & 2a away which is what the Dems and Libs want. Just an observation and ?.,Strong Agreement,4.0,108.0,9.66e+17,841777388.0,2/21/2018 0:04,6 days 09:34:24.000000000,6.0,2237 days 22:09:16.034922000,6.0,31,53.27,97.31,1.0,1.23,6.2,19.35,74.19,45.16,16.13,12.9,3.23,0.0,6.45,3.23,3.23,6.45,9.68,12.9,3.23,3.23,0.0,22.58,0.0,3.23,0.0,0.0,3.23,3.23,0.0,3.23,0.0,22.58,9.68,6.45,0.0,0.0,0.0,3.23,3.23,0.0,6.45,0.0,0.0,3.23,0.0,0.0,0.0,0.0,12.9,9.68,0.0,6.45,3.23,3.23,0.0,3.23,0.0,22.58,19.35,0.0,0.0,0.0,3.23,0.0
386,33315551.0,Robert Witcher,Robert_W_GA,"Georgia, USA","God, Family, Country! Differentiate between smart and bright. Improvise, adapt, overcome. Be prepared when opportunity knocks! #FBTS Follow-back or be gone!",4766.0,4741.0,4.0,4/19/2009 0:21,24591.0,,47665.0,en,FBI,Hey @JesseBWatters get a look at this!,Neutral,3.0,110.0,9.66e+17,33315551.0,2/21/2018 0:03,6 days 09:33:29.000000000,6.0,3490 days 22:02:03.034922000,9.0,44,68.79,41.03,19.82,3.73,22.0,9.09,79.55,59.09,9.09,2.27,0.0,0.0,0.0,2.27,6.82,11.36,13.64,9.09,6.82,13.64,0.0,22.73,2.27,2.27,6.82,0.0,0.0,2.27,0.0,2.27,0.0,4.55,0.0,13.64,2.27,2.27,4.55,2.27,0.0,6.82,2.27,0.0,2.27,2.27,0.0,0.0,0.0,2.27,4.55,13.64,2.27,11.36,2.27,4.55,4.55,2.27,2.27,11.36,4.55,0.0,2.27,0.0,0.0,4.55
387,8.65e+17,tarmin grainy,TarminGrainy,"Long Grove, IL",I'm just a girl who sometimes likes baseball and always loves reading. #Chicago,10.0,99.0,1.0,5/19/2017 0:01,56.0,,75.0,en,FBI,"People have minds of their own, Lucian. This is still America.",Weak Disagreement,4.0,111.0,9.66e+17,8.65e+17,2/21/2018 0:02,6 days 09:32:46.000000000,6.0,538 days 22:22:20.034922000,1.0,7,99.0,92.33,13.15,25.77,7.0,14.29,85.71,42.86,14.29,0.0,0.0,0.0,0.0,0.0,14.29,14.29,14.29,0.0,0.0,0.0,0.0,28.57,0.0,0.0,0.0,0.0,0.0,0.0,0.0,0.0,0.0,14.29,0.0,0.0,0.0,0.0,0.0,0.0,0.0,0.0,14.29,14.29,0.0,14.29,0.0,0.0,0.0,14.29,0.0,28.57,0.0,14.29,0.0,14.29,0.0,0.0,14.29,28.57,0.0,0.0,0.0,14.29,0.0,14.29
388,209111938.0,Jeffersonian,Ellsworth_Lies,,"Americans need the truth, regardless if it means they must question everything the MSM ever told them to believe! We are being deceived daily by our govt & MSM!",546.0,567.0,27.0,10/28/2010 0:14,5178.0,,20295.0,en,FBI,It's all Fake!  That guy has a drug record!  He sure as heck isn't a teen in HS!,Strong Disagreement,3.0,112.0,9.66e+17,209111938.0,2/21/2018 0:02,6 days 09:32:39.000000000,6.0,2933 days 22:08:35.034922000,8.0,11,12.85,96.52,2.4,25.77,5.5,9.09,63.64,54.55,18.18,9.09,0.0,0.0,0.0,9.09,9.09,0.0,9.09,18.18,9.09,0.0,0.0,18.18,0.0,0.0,0.0,0.0,0.0,0.0,0.0,0.0,0.0,18.18,0.0,0.0,0.0,0.0,0.0,0.0,0.0,0.0,0.0,0.0,0.0,0.0,0.0,0.0,0.0,0.0,0.0,18.18,0.0,9.09,0.0,0.0,9.09,0.0,0.0,27.27,18.18,9.09,0.0,0.0,0.0,0.0
389,7.98e+17,S.F.,ProudOkie897,United States,Left wants to control Twitter because this is how real grass roots nationalist communicate and share information.  I follow every MAGA conservative.,2260.0,4568.0,1.0,11/13/2016 0:18,4523.0,,10248.0,en,FBI,The FBI knew about the shooter and didn't nothing.  It is looking more and more that this was not a mistake but the FBI intentionally ignored the warning so that they could use the event to promote gun control,Weak Agreement,3.0,113.0,9.66e+17,7.98e+17,2/21/2018 0:02,6 days 09:32:01.000000000,6.0,725 days 22:05:11.034922000,1.0,18,45.11,50.0,1.0,25.77,6.0,0.0,88.89,50.0,16.67,5.56,0.0,0.0,5.56,0.0,11.11,11.11,11.11,16.67,0.0,5.56,5.56,16.67,11.11,5.56,0.0,0.0,5.56,11.11,5.56,5.56,0.0,16.67,11.11,16.67,0.0,0.0,0.0,0.0,11.11,5.56,0.0,0.0,5.56,5.56,0.0,0.0,5.56,0.0,0.0,16.67,0.0,5.56,0.0,5.56,0.0,0.0,5.56,27.78,0.0,0.0,0.0,16.67,11.11,0.0
390,9.27e+17,IanMichaelBarnett,_Ian_Barnett_,"Yorba Linda, CA",Husband. Father. Patriot. Politics. Off-road trucks. Camping. Hockey. Performance Plus Oil. Safety-Kleen. @performancePoil,59.0,195.0,0.0,11/3/2017 0:18,2270.0,,1650.0,en,FBI,People better wake up,Strong Agreement,3.0,114.0,9.66e+17,9.27e+17,2/21/2018 0:01,6 days 09:31:51.000000000,6.0,370 days 22:04:32.034922000,1.0,39,35.66,10.0,1.4,1.0,19.5,23.08,89.74,58.97,12.82,2.56,0.0,0.0,0.0,2.56,10.26,15.38,5.13,10.26,5.13,10.26,7.69,20.51,5.13,5.13,0.0,0.0,5.13,7.69,0.0,7.69,0.0,2.56,0.0,25.64,2.56,7.69,5.13,0.0,2.56,7.69,2.56,2.56,0.0,7.69,0.0,2.56,2.56,2.56,10.26,5.13,0.0,2.56,0.0,0.0,2.56,2.56,0.0,5.13,2.56,0.0,0.0,0.0,2.56,0.0
391,8.12e+17,Jerryk,g_jerryk,"Florida, USA","Hardcore conservative, biker, husband and father. Former Special Forces & Vietnam Veteran. Love & Respect the Flag & Country.   MAGA, 2ND AMENDMENT.",540.0,622.0,0.0,12/23/2016 0:23,138.0,,656.0,en,FBI,A drug addict as well...27 yrs old impersonating a high school student... Have they no limits..,Strong Agreement,3.0,116.0,9.66e+17,8.12e+17,2/21/2018 0:00,6 days 09:30:48.000000000,6.0,685 days 22:00:03.034922000,1.0,4,99.0,99.0,74.76,99.0,4.0,0.0,100.0,25.0,0.0,0.0,0.0,0.0,0.0,0.0,0.0,0.0,25.0,0.0,0.0,0.0,0.0,0.0,25.0,25.0,0.0,0.0,0.0,25.0,25.0,0.0,0.0,25.0,0.0,0.0,0.0,0.0,0.0,0.0,0.0,0.0,0.0,0.0,25.0,50.0,0.0,25.0,25.0,25.0,0.0,0.0,0.0,25.0,0.0,25.0,0.0,0.0,0.0,0.0,0.0,0.0,0.0,0.0,0.0,0.0
392,9.61e+17,The Dispatcher,colleen2301,"Arizona, USA","#MAGA 
#AZPatriot #NRA #1A #2A #Americafirst
              








                             #Walkaway #IstandwithICE
#IstandwithJimJordan
#WWG1WGA",3633.0,4788.0,5.0,2/5/2018 0:21,14959.0,,9657.0,en,FBI,How did he know to be in FL at this time?,Weak Agreement,4.0,117.0,9.66e+17,9.61e+17,2/21/2018 0:00,6 days 09:30:21.000000000,6.0,276 days 22:01:25.034922000,0.0,17,73.36,50.0,6.2,98.87,8.5,11.76,82.35,41.18,5.88,5.88,0.0,0.0,0.0,5.88,0.0,11.76,5.88,5.88,5.88,5.88,5.88,5.88,11.76,5.88,0.0,5.88,0.0,5.88,5.88,0.0,0.0,5.88,0.0,0.0,0.0,0.0,0.0,0.0,0.0,0.0,0.0,0.0,11.76,17.65,0.0,5.88,11.76,0.0,0.0,5.88,0.0,11.76,0.0,5.88,5.88,11.76,5.88,41.18,41.18,0.0,0.0,0.0,0.0,0.0
393,432133166.0,Joshua Smith,JoshRunsThis,South Carolina,I... I RUN... I RUN THIS!!!,24.0,38.0,6.0,12/9/2011 0:02,144.0,,557.0,en,FBI,David Hogg is a crisis actor. He's not real! Look it up. #DavidHogg,Strong Agreement,4.0,118.0,9.66e+17,432133166.0,2/21/2018 0:00,6 days 09:30:21.000000000,6.0,2526 days 22:20:51.034922000,6.0,11,31.44,81.84,85.21,25.77,11.0,0.0,90.91,72.73,18.18,9.09,0.0,0.0,9.09,0.0,9.09,0.0,27.27,18.18,9.09,9.09,0.0,27.27,0.0,0.0,9.09,0.0,0.0,0.0,0.0,0.0,0.0,9.09,9.09,18.18,9.09,9.09,0.0,0.0,0.0,0.0,0.0,0.0,0.0,0.0,0.0,0.0,0.0,0.0,9.09,18.18,0.0,27.27,0.0,18.18,9.09,0.0,0.0,9.09,0.0,0.0,9.09,0.0,0.0,0.0
394,7.99e+17,Mercedes,VaMercedeslady,,"R.E. Investor, politics, love animals & decorating! True conservative .......MAGA!",1174.0,985.0,14.0,11/16/2016 0:02,15026.0,,47668.0,en,FBI,@RealDonaldTrump@SeanHannity@LauraIngraham read,Neutral,3.0,119.0,9.66e+17,7.99e+17,2/21/2018 0:00,6 days 09:30:06.000000000,6.0,722 days 22:20:47.034922000,1.0,13,42.69,22.08,1.4,25.77,3.25,7.69,69.23,46.15,15.38,7.69,0.0,0.0,7.69,0.0,7.69,7.69,7.69,15.38,0.0,0.0,7.69,23.08,0.0,0.0,0.0,0.0,0.0,0.0,0.0,0.0,0.0,7.69,7.69,7.69,0.0,0.0,0.0,0.0,0.0,7.69,7.69,7.69,0.0,15.38,0.0,0.0,7.69,0.0,0.0,23.08,0.0,7.69,0.0,7.69,0.0,0.0,0.0,38.46,15.38,0.0,0.0,7.69,7.69,7.69
395,34429656.0,Gustavo Mendes,ghmendes,,,39.0,356.0,0.0,4/22/2009 0:22,1057.0,,655.0,pt,FBI,https://twitter.com/OfficeOfMike/status/966095421134209024 â¦,Neutral,8.0,120.0,9.66e+17,34429656.0,2/20/2018 0:23,5 days 09:53:48.000000000,5.0,3487 days 22:00:36.034922000,9.0,4,92.84,50.0,1.0,25.77,4.0,75.0,25.0,0.0,0.0,0.0,0.0,0.0,0.0,0.0,0.0,0.0,0.0,0.0,0.0,0.0,0.0,25.0,0.0,0.0,0.0,0.0,0.0,0.0,0.0,0.0,0.0,0.0,0.0,0.0,0.0,0.0,0.0,0.0,0.0,0.0,0.0,0.0,0.0,0.0,0.0,0.0,0.0,0.0,0.0,0.0,0.0,0.0,0.0,0.0,0.0,25.0,0.0,75.0,0.0,0.0,0.0,0.0,0.0,75.0
396,9.61e+17,Nanny Lee,NannyLee5,,,81.0,120.0,0.0,2/5/2018 0:19,1050.0,,1448.0,en,FBI,@poorman and another... and FBI agents son.... confused .....,Neutral,4.0,121.0,9.66e+17,9.61e+17,2/20/2018 0:23,5 days 09:53:41.000000000,5.0,276 days 22:03:51.034922000,0.0,8,92.84,89.42,1.0,25.77,8.0,25.0,37.5,0.0,0.0,0.0,0.0,0.0,0.0,0.0,0.0,0.0,0.0,0.0,0.0,0.0,0.0,0.0,0.0,0.0,0.0,12.5,0.0,0.0,0.0,0.0,0.0,12.5,0.0,0.0,0.0,0.0,0.0,0.0,0.0,0.0,0.0,0.0,0.0,25.0,12.5,0.0,12.5,0.0,0.0,0.0,0.0,0.0,0.0,0.0,0.0,0.0,25.0,75.0,12.5,0.0,0.0,0.0,0.0,62.5
397,7.63e+17,Janice M Malinovsky,JanmalinJanice,"Ohio, USA","❤️ animals, hist., reading, casino gambling, Anglophile, the USA, & Pres.Trump! Cons. Repub. Blue Lives Matter. Not PC. MAGA!",865.0,796.0,2.0,8/8/2016 0:23,30010.0,,12672.0,en,FBI,Well isnât that special...,Weak Agreement,4.0,122.0,9.66e+17,7.63e+17,2/20/2018 0:23,5 days 09:53:26.000000000,5.0,822 days 22:00:04.034922000,2.0,8,11.24,89.42,1.0,1.0,2.67,37.5,75.0,37.5,12.5,0.0,0.0,0.0,0.0,0.0,12.5,0.0,0.0,0.0,0.0,25.0,0.0,0.0,0.0,0.0,0.0,0.0,12.5,12.5,0.0,12.5,0.0,12.5,12.5,12.5,0.0,0.0,0.0,12.5,0.0,0.0,0.0,0.0,0.0,0.0,0.0,0.0,0.0,0.0,0.0,0.0,0.0,0.0,0.0,0.0,0.0,12.5,0.0,162.5,150.0,0.0,0.0,0.0,0.0,12.5
398,2574192306.0,ladyB,009fromIL,,"working mother, my kids r my strength, coffee lover, traveling, feminist, immigrant, religion is not my priority, spirituality n humanity is✌️",61.0,335.0,6.0,6/18/2014 0:05,3363.0,,5219.0,en,FBI,"Exposed brings out a different expression under trump presidency, use that word sparingly",Weak Disagreement,3.0,123.0,9.66e+17,2574192306.0,2/20/2018 0:23,5 days 09:53:22.000000000,5.0,1604 days 22:17:48.034922000,4.0,5,8.19,50.0,1.0,99.0,5.0,20.0,60.0,40.0,20.0,0.0,0.0,0.0,0.0,0.0,20.0,0.0,0.0,0.0,20.0,0.0,0.0,0.0,20.0,0.0,0.0,0.0,0.0,40.0,40.0,0.0,0.0,0.0,0.0,0.0,0.0,0.0,0.0,0.0,0.0,0.0,0.0,0.0,0.0,0.0,0.0,0.0,0.0,0.0,0.0,0.0,0.0,0.0,0.0,0.0,0.0,0.0,20.0,60.0,60.0,0.0,0.0,0.0,0.0,0.0
399,7.64e+17,Goldfish You're the Puppet☘🐠⚾️,Goldfishboston,Boston,"Demographic: 35-54, female professional.  Concerned citizen.  Fan of justice and heroic journalism",9.0,49.0,0.0,8/13/2016 0:01,4512.0,,2312.0,en,FBI,There is something seriously wrong with you.,Strong Disagreement,5.0,126.0,9.66e+17,7.64e+17,2/20/2018 0:23,5 days 09:53:06.000000000,5.0,817 days 22:21:51.034922000,2.0,13,99.0,50.0,94.81,25.77,13.0,38.46,69.23,30.77,7.69,0.0,0.0,0.0,0.0,0.0,7.69,7.69,15.38,0.0,0.0,0.0,0.0,15.38,7.69,7.69,0.0,0.0,0.0,0.0,0.0,0.0,0.0,7.69,0.0,15.38,0.0,7.69,0.0,0.0,0.0,7.69,0.0,0.0,7.69,15.38,0.0,0.0,15.38,0.0,0.0,15.38,0.0,23.08,7.69,15.38,0.0,7.69,0.0,7.69,0.0,7.69,0.0,0.0,0.0,0.0
400,6.98e+17,President TRUMP,GodsCHOICE936,California,Really .....,1717.0,1622.0,38.0,2/11/2016 0:08,30068.0,,33660.0,en,FBI,Busted.... We must expose the FBI agent and his background,Strong Agreement,4.0,128.0,9.66e+17,6.98e+17,2/20/2018 0:22,5 days 09:52:14.000000000,5.0,1001 days 22:14:41.034922000,2.0,7,1.0,99.0,1.0,1.0,7.0,28.57,100.0,85.71,28.57,14.29,0.0,14.29,0.0,0.0,14.29,0.0,14.29,14.29,28.57,0.0,0.0,14.29,14.29,0.0,0.0,0.0,0.0,28.57,0.0,28.57,0.0,14.29,0.0,14.29,0.0,0.0,0.0,14.29,0.0,0.0,0.0,0.0,0.0,14.29,0.0,0.0,0.0,0.0,0.0,14.29,0.0,0.0,0.0,0.0,0.0,0.0,0.0,14.29,14.29,0.0,0.0,0.0,0.0,0.0
401,34517616.0,john peters,2blacksocks,,"Indoctrinated by Grade School, Educated by Real Life   Need to learn that sometimes it's ""better to be thought a fool, than open my mouth and remove all doubt""",471.0,749.0,1.0,4/23/2009 0:03,4174.0,,3228.0,en,FBI,#HoggWash,Strong Disagreement,3.0,129.0,9.66e+17,34517616.0,2/20/2018 0:22,5 days 09:52:05.000000000,5.0,3486 days 22:19:52.034922000,9.0,10,24.86,99.0,1.0,25.77,5.0,10.0,60.0,50.0,20.0,20.0,0.0,0.0,10.0,0.0,0.0,10.0,0.0,10.0,0.0,10.0,0.0,10.0,0.0,0.0,0.0,0.0,0.0,0.0,0.0,0.0,0.0,20.0,10.0,10.0,0.0,0.0,10.0,0.0,10.0,0.0,0.0,0.0,0.0,10.0,10.0,0.0,0.0,0.0,0.0,0.0,0.0,0.0,0.0,0.0,0.0,10.0,0.0,40.0,40.0,0.0,0.0,0.0,0.0,0.0
402,7.97e+17,John A Stroud,JohnAStroud1,,,1.0,13.0,0.0,11/12/2016 0:17,2.0,,53.0,en,FBI,He's a plant black hat response team member,Strong Agreement,4.0,130.0,9.66e+17,7.97e+17,2/20/2018 0:21,5 days 09:51:48.000000000,5.0,726 days 22:06:04.034922000,1.0,1,92.84,50.0,1.0,25.77,1.0,100.0,0.0,0.0,0.0,0.0,0.0,0.0,0.0,0.0,0.0,0.0,0.0,0.0,0.0,0.0,0.0,0.0,0.0,0.0,0.0,0.0,0.0,0.0,0.0,0.0,0.0,0.0,0.0,0.0,0.0,0.0,0.0,0.0,0.0,0.0,0.0,0.0,0.0,0.0,0.0,0.0,0.0,0.0,0.0,0.0,0.0,0.0,0.0,0.0,0.0,0.0,0.0,100.0,0.0,0.0,0.0,0.0,0.0,100.0
403,7.08e+17,CAD,cduff22,United States,"MAGA, Father, Beekeeper,
Active outdoors🇺🇸🇺🇸🇺🇸",397.0,340.0,1.0,3/10/2016 0:04,1846.0,,708.0,en,FBI,"To use FBI agents son, as staged acting front for this gun grab is treasonous. Now I know the FBI is killing our kids in school. Mr. President what the fuck are you doing?",Strong Agreement,3.0,131.0,9.66e+17,7.08e+17,2/20/2018 0:21,5 days 09:51:22.000000000,5.0,973 days 22:19:22.034922000,2.0,8,71.61,99.0,1.0,25.77,8.0,12.5,75.0,25.0,12.5,12.5,0.0,0.0,12.5,0.0,0.0,12.5,0.0,12.5,0.0,0.0,0.0,12.5,0.0,0.0,0.0,0.0,0.0,0.0,0.0,0.0,0.0,37.5,12.5,12.5,0.0,12.5,0.0,0.0,0.0,0.0,12.5,12.5,0.0,25.0,25.0,12.5,0.0,0.0,0.0,12.5,0.0,0.0,0.0,0.0,0.0,12.5,0.0,12.5,0.0,0.0,0.0,0.0,12.5,0.0
404,274558023.0,Sue Lattavo,Hotpep2706,,,5.0,26.0,0.0,3/30/2011 0:14,797.0,,1120.0,en,FBI,And WHY are you so dumb???  THAT is the one thousand dollar question!!!!!,Strong Disagreement,4.0,132.0,9.66e+17,274558023.0,2/20/2018 0:21,5 days 09:51:05.000000000,5.0,2780 days 22:08:41.034922000,7.0,34,66.07,88.03,14.7,1.0,11.33,8.82,79.41,47.06,14.71,8.82,2.94,2.94,0.0,0.0,5.88,5.88,11.76,11.76,2.94,2.94,0.0,23.53,2.94,2.94,2.94,0.0,0.0,5.88,0.0,5.88,5.88,11.76,2.94,5.88,2.94,2.94,0.0,0.0,0.0,0.0,2.94,0.0,2.94,5.88,2.94,0.0,2.94,0.0,0.0,20.59,0.0,8.82,0.0,5.88,2.94,8.82,2.94,14.71,8.82,2.94,2.94,0.0,0.0,0.0
405,135058446.0,Paws- the- Cat,Morgyau,On the Windowsill In The Sun,Coffee is Good Its a Food Group,182.0,139.0,22.0,4/20/2010 0:06,4277.0,,30589.0,en,FBI,"Rights idiot?  What happened to the biggest right we have? "" The Right to Life""  which is also in the constitution and which you are advocating you would take away",Strong Disagreement,6.0,133.0,9.66e+17,135058446.0,2/20/2018 0:20,5 days 09:50:51.000000000,5.0,3124 days 22:16:55.034922000,8.0,13,1.0,93.79,1.4,1.0,6.5,15.38,100.0,61.54,15.38,7.69,0.0,7.69,0.0,0.0,7.69,7.69,0.0,15.38,15.38,15.38,0.0,15.38,7.69,0.0,7.69,15.38,0.0,7.69,0.0,7.69,7.69,15.38,0.0,15.38,7.69,7.69,0.0,7.69,0.0,0.0,0.0,0.0,0.0,0.0,0.0,0.0,0.0,0.0,0.0,15.38,0.0,0.0,0.0,0.0,0.0,0.0,7.69,61.54,0.0,0.0,23.08,38.46,0.0,0.0
406,506655426.0,ria hale,RiaHale,,,76.0,78.0,3.0,2/28/2012 0:01,4508.0,,10632.0,en,FBI,FBI NEEDS TO BE SHUT DOWN BC OF CORRUPTION,Strong Agreement,4.0,134.0,9.66e+17,506655426.0,2/20/2018 0:20,5 days 09:50:33.000000000,5.0,2445 days 22:22:24.034922000,6.0,29,49.46,95.75,11.5,1.0,9.67,13.79,89.66,65.52,20.69,10.34,0.0,6.9,0.0,0.0,10.34,10.34,13.79,13.79,3.45,6.9,0.0,20.69,3.45,3.45,10.34,0.0,0.0,3.45,0.0,3.45,3.45,10.34,0.0,3.45,0.0,0.0,3.45,0.0,0.0,0.0,0.0,0.0,3.45,10.34,3.45,0.0,3.45,3.45,3.45,13.79,0.0,17.24,0.0,17.24,0.0,0.0,3.45,13.79,0.0,0.0,6.9,0.0,0.0,0.0
407,8.98e+17,Carol Donaldson,caroldon46,,,16.0,55.0,0.0,8/17/2017 0:01,2888.0,,3606.0,en,FBI,David Hogg the con artist,Strong Agreement,3.0,136.0,9.66e+17,8.98e+17,2/20/2018 0:20,5 days 09:50:07.000000000,5.0,448 days 22:21:41.034922000,1.0,9,98.75,50.0,4.97,25.77,9.0,11.11,77.78,55.56,0.0,0.0,0.0,0.0,0.0,0.0,0.0,0.0,33.33,11.11,0.0,11.11,0.0,33.33,11.11,0.0,0.0,0.0,0.0,0.0,0.0,0.0,0.0,0.0,0.0,22.22,0.0,11.11,11.11,0.0,0.0,0.0,0.0,0.0,0.0,11.11,0.0,0.0,11.11,0.0,0.0,22.22,0.0,22.22,0.0,22.22,0.0,0.0,11.11,0.0,0.0,0.0,0.0,0.0,0.0,0.0
408,615333663.0,WILLY HERRERA,wherrera72,"MIAMI, FLORIDA","LOVE MY FAMILY, GOD & TRANS AMS, TRUMP REPUBLICAN, PHD IN SARCASM, COMMON SENSE & RIGHTHEOUS, MAGA MAGA! NOT PC, BARACK DAMMIT LIBTARDIGANS!
RETWEET=ENDORSEMENT",560.0,586.0,2.0,6/22/2012 0:15,658.0,,4098.0,en,FBI,"LIKE D SONG SAY'S,""THE LITTLE FAGGOT, HE'S AN FBI PAWN""! OH WELL,I MIGHT HAVE CHANGED SOMETHING,BUT SING IT 4 UR SELF,IM SURE YOU'LL LIKE IT",Neutral,4.0,137.0,9.66e+17,615333663.0,2/20/2018 0:19,5 days 09:49:30.000000000,5.0,2330 days 22:08:07.034922000,6.0,5,99.0,50.0,1.0,25.77,5.0,0.0,40.0,20.0,0.0,0.0,0.0,0.0,0.0,0.0,0.0,20.0,0.0,0.0,0.0,0.0,0.0,0.0,0.0,0.0,0.0,0.0,0.0,0.0,0.0,0.0,0.0,0.0,0.0,0.0,0.0,0.0,0.0,0.0,0.0,0.0,0.0,0.0,0.0,0.0,0.0,0.0,0.0,0.0,0.0,0.0,0.0,0.0,0.0,0.0,0.0,0.0,0.0,0.0,0.0,0.0,0.0,0.0,0.0,0.0
409,7.5e+17,▚▙ ᵛ ᵒ i ᵈ ∵ ᵖ ᵃ r ᵃ ᵍ ᵒ ᵑ ▜▞,ether_d_r_i_f_t,"52.479761, 62.185661","I bid thee welcome to this distant setting, now bow down for your blessing and allow me to slap some shrimp upon your lips.",43.0,128.0,1.0,7/3/2016 0:22,2409.0,,5254.0,en,FBI,"He's also in an interview in Los Angeles about a confrontation with a lifeguard, kid gets a lot of air time..",Weak Agreement,3.0,138.0,9.66e+17,7.5e+17,2/20/2018 0:19,5 days 09:49:17.000000000,5.0,858 days 22:00:42.034922000,2.0,29,10.67,75.49,11.5,99.0,14.5,6.9,82.76,55.17,27.59,17.24,6.9,6.9,3.45,0.0,10.34,6.9,6.9,17.24,3.45,3.45,0.0,24.14,0.0,6.9,0.0,3.45,0.0,6.9,6.9,0.0,0.0,13.79,3.45,17.24,0.0,3.45,0.0,6.9,3.45,3.45,6.9,0.0,0.0,0.0,0.0,0.0,0.0,0.0,3.45,13.79,6.9,6.9,3.45,3.45,0.0,0.0,13.79,37.93,0.0,17.24,0.0,3.45,10.34,0.0
410,9.01e+17,Romundo bryant,RomundoB,Columbia Mississippi ,Laid back,79.0,323.0,0.0,8/25/2017 0:12,682.0,,225.0,en,FBI,I guess all the kids parents are FBI agents gtfooh,Strong Disagreement,3.0,140.0,9.66e+17,9.01e+17,2/20/2018 0:18,5 days 09:48:51.000000000,5.0,440 days 22:10:50.034922000,1.0,21,99.0,92.33,13.15,1.0,21.0,19.05,85.71,52.38,4.76,4.76,0.0,0.0,4.76,0.0,0.0,19.05,23.81,4.76,9.52,4.76,0.0,9.52,0.0,0.0,0.0,0.0,4.76,4.76,0.0,4.76,4.76,14.29,4.76,4.76,0.0,0.0,0.0,4.76,0.0,0.0,0.0,0.0,0.0,9.52,0.0,0.0,4.76,4.76,0.0,9.52,0.0,19.05,0.0,14.29,4.76,4.76,0.0,19.05,9.52,4.76,0.0,0.0,4.76,0.0
411,7.15e+17,#KeepAmericaGreat,Ike19777,"Louisiana, USA","Honored to by followed by Charles Payne, General Flynn, Antonio Sabato Jr ,American first - I believe in Trump. retweets are not endorsement Will Follow back",10562.0,10687.0,67.0,3/29/2016 0:23,121919.0,,86051.0,en,FBI,https://youtu.be/HvZD7UkJd24   He is in this video too from earlier,Neutral,3.0,141.0,9.66e+17,7.15e+17,2/20/2018 0:18,5 days 09:48:47.000000000,5.0,954 days 22:00:02.034922000,2.0,10,77.33,84.14,3.37,25.77,10.0,10.0,80.0,30.0,10.0,10.0,10.0,0.0,0.0,0.0,0.0,10.0,0.0,10.0,0.0,0.0,0.0,20.0,0.0,0.0,0.0,0.0,10.0,0.0,0.0,0.0,0.0,20.0,0.0,20.0,0.0,0.0,0.0,10.0,10.0,0.0,0.0,0.0,0.0,10.0,10.0,0.0,0.0,0.0,0.0,20.0,0.0,0.0,0.0,0.0,0.0,10.0,0.0,0.0,0.0,0.0,0.0,0.0,0.0,0.0
412,8.24e+17,Linda,foxybubba18,"New Jersey, USA","I Love Jesus 
Ban Sharia Law
President Trump Rocks
No sanctuary cities
Honored to be followed by General Michael Flynn
#MAGA",6415.0,6962.0,12.0,1/24/2017 0:00,93053.0,,62925.0,en,FBI,Sting operation?,Weak Agreement,3.0,142.0,9.66e+17,8.24e+17,2/20/2018 0:18,5 days 09:48:44.000000000,5.0,653 days 22:23:21.034922000,1.0,13,42.69,77.92,1.4,25.77,13.0,15.38,76.92,53.85,15.38,7.69,0.0,0.0,7.69,0.0,7.69,0.0,15.38,15.38,7.69,0.0,0.0,15.38,7.69,7.69,0.0,0.0,0.0,0.0,0.0,0.0,0.0,7.69,7.69,0.0,0.0,0.0,0.0,0.0,0.0,0.0,7.69,7.69,0.0,0.0,0.0,0.0,0.0,0.0,7.69,15.38,0.0,15.38,0.0,7.69,7.69,0.0,7.69,23.08,7.69,0.0,0.0,0.0,0.0,15.38
